{
  "version": "fixture-not-a-coffee-model",
  "labels": [
    "healthy",
    "rust",
    "cercospora",
    "phoma",
    "miner",
    "not_leaf"
  ],
  "input": {
    "size": 224,
    "resize": "shorter_side_then_center_crop",
    "mean": [
      0.485,
      0.456,
      0.406
    ],
    "std": [
      0.229,
      0.224,
      0.225
    ],
    "layout": "NCHW",
    "range": "0-1"
  },
  "temperature": 1.0,
  "threshold": 0.6,
  "sha256": "",
  "bytes": 0
}